{
  "schema_version": "0.30.1",
  "id": "selective-1-ch02-s01-close-reading",
  "book": "人教版《地理·选择性必修1·自然地理基础》",
  "chapter": "第二章 地表形态的塑造",
  "section": "第一节 塑造地表形态的力量",
  "status": "published",
  "textbook_image_base": "./assets/textbook/selective-1-ch02-s01",
  "page_start": 18,
  "page_end": 25,
  "method": {
    "student_steps": [
      "先看页码、标题、图名和图注，用一句话判断本页在回答什么问题。",
      "通读正文，找出表示条件、过程、结果和例证的句子，不急着展开辅助内容。",
      "依次展开“图片解读—逐页解析—知识发散—本页总结”，核对自己漏掉的关系；再次点击即可收起。",
      "合上全部辅助内容，根据教材原页回答“本页三问”，能讲清后标记本页已读。"
    ],
    "completion_rule": "8页均完成原页阅读并能回答本页三问；再完成4道配套题；家长任选2页听橙子脱离辅助内容复述。"
  },
  "pages": [
    {
      "page": 18,
      "pdf_page": 23,
      "title": "庐山之问：从景观矛盾进入内力作用",
      "focus": "本页先用庐山“山体陡立、山顶较平”的反差提出全章问题，再介绍内力作用的能量来源、速度差异和三种表现。",
      "image": "page-18.jpg",
      "read_targets": [
        "庐山照片里哪两种形态看起来矛盾？",
        "内力作用的能量从哪里来，主要有哪些表现？",
        "图2.2怎样证明内力作用既能很快发生，也能改变地表？"
      ],
      "image_reading": [
        {
          "figure": "图2.1 庐山与鄱阳湖航拍照片",
          "observe": "山体从鄱阳湖一带的低平地面突然升起，四周坡陡；海拔约1100米处却有较平坦的开阔地和城镇。",
          "interpret": "“陡立”说明山体经历过明显抬升或断裂，“山顶平台”说明较平地形形成在先、后来随山体一起抬升。两类形态并存，提示地貌常是多阶段、内外力共同作用的结果。",
          "exam_link": "根据坡度突变、平台高度和周边低地，判断地壳抬升及后期外力改造；材料题常要求分阶段说明。"
        },
        {
          "figure": "图2.2 基拉韦厄火山流淌的岩浆",
          "observe": "炽热岩浆已喷出地表并向海岸流动，图注说明岩浆使夏威夷岛面积不断扩大。",
          "interpret": "喷出地表的岩浆冷却后形成新岩体，能在较短时间直接改变海岸线和岛屿面积；地下岩浆活动则不一定直接改变地表。",
          "exam_link": "区分“岩浆活动”和“火山喷发”，判断某作用能否直接塑造地表。"
        }
      ],
      "analysis": [
        "课本用两个问题组织本节：什么力量使庐山从平原边缘抬起，什么力量又形成山顶平台。前者主要指向内力作用，后者主要指向外力作用。",
        "内力作用的能量主要来自地球内部的热能。能量来源回答“为什么能发生”，地壳运动、岩浆活动和变质作用回答“以什么方式发生”，两者不能混写。",
        "内力作用有快慢差异。火山喷发、地震可能瞬间改变地表；缓慢地壳运动不易直接察觉，却能在漫长地质年代累积成显著地貌。",
        "三种内力表现对地表影响不同：地壳运动是主要塑形方式；岩浆只有喷出地表时才直接塑形；变质作用通常发生在地壳深处。",
        "读这一页要建立时间观：今天看到的地貌不是一次事件的照片，而是不同速度、不同阶段作用叠加后的结果。"
      ],
      "extensions": [
        "高考常把“能量来源—作用形式—地貌结果”拆成三个层次设问，答题时先确定题目问的是哪一层。",
        "突发事件影响快，不等于塑造范围一定最大；缓慢运动虽然单次变化小，长期累计可以形成山脉、高原和盆地格局。",
        "火山岛面积扩大是岩浆喷出并冷却堆积的结果；若材料只说地下岩浆侵入，不能直接推出地表面积扩大。",
        "陌生景观先找矛盾：陡坡与平台、深谷与高原面、海洋化石与高山位置，往往都是恢复地貌过程的入口。"
      ],
      "transfer": "地貌成因题先分两层：内力奠定基本起伏，外力继续侵蚀、搬运和堆积；再根据材料写出具体阶段。",
      "summary": {
        "core": "地表形态会被来自地球内部热能的内力作用改变，作用有快有慢，主要表现为地壳运动、岩浆活动和变质作用。",
        "chain": "内部热能 → 地壳运动/岩浆活动/变质作用 → 地表基本起伏发生变化",
        "terms": [
          "内力作用",
          "地球内部热能",
          "地壳运动",
          "岩浆活动",
          "变质作用"
        ],
        "pitfall": "三种内力作用不是三种地貌；岩浆活动也不是都能直接塑造地表。"
      }
    },
    {
      "page": 19,
      "pdf_page": 24,
      "title": "地壳运动：从地质痕迹反推变化过程",
      "focus": "本页说明为什么地壳运动是主要内力，并用受力示意和三段材料训练“证据—过程—结果”的地质推理。",
      "image": "page-19.jpg",
      "read_targets": [
        "受挤压与受拉伸时，岩层形态分别怎样变化？",
        "为什么地壳运动比变质作用更能直接塑造地表？",
        "活动a、b、c分别留下了什么证据，可以推出怎样的过程？"
      ],
      "image_reading": [
        {
          "figure": "图2.3a 岩层受到挤压",
          "observe": "水平岩层从两侧受力后弯曲、缩短，局部向上拱起。",
          "interpret": "挤压力可使岩层褶皱、断裂并造成地面隆升；庐山材料中的岩层挤压、断裂和局部抬升属于这一逻辑。",
          "exam_link": "从岩层弯曲、断裂或山地隆起判断水平挤压，并说明岩层变形或变位。"
        },
        {
          "figure": "图2.3b 岩层被拉伸",
          "observe": "岩层受到向两侧的张力，长度增加，中间出现断裂和错动。",
          "interpret": "拉张会使岩层变薄、破裂，局部地块可能下沉；题图中的断层和地堑常与这种受力有关。",
          "exam_link": "根据断层两侧相对升降判断拉张或挤压背景，不能只看到裂缝就下结论。"
        },
        {
          "figure": "活动材料a—c的时间证据",
          "observe": "a是高山岩石中的螺蚌壳，b是神庙石柱高处的海生动物蛀蚀痕迹，c记录火山锥一天至一周内迅速长高。",
          "interpret": "a说明海相物质后来被抬升；b说明神庙建成后曾下沉到海水中、后来又抬升；c说明岩浆喷出可在很短时间形成新地貌。",
          "exam_link": "利用化石位置、海蚀痕迹和文字时间节点，恢复多阶段升降过程并比较变化速度。"
        }
      ],
      "analysis": [
        "地壳运动指岩石圈受内力作用发生变位或变形，也叫构造运动。变形强调岩层形状改变，变位强调空间位置改变，实际过程常同时出现。",
        "岩石圈破裂后，深处岩浆可以沿裂隙上升，侵入岩石圈或喷出地表；已有岩石受温度、压力影响，成分和结构改变，形成变质作用。",
        "变质作用多在地壳深处，不能直接塑造地表；岩浆活动只有喷出地表时才可直接影响地表。因此地壳运动是塑造地表形态的主要内力方式。",
        "地壳运动可表现为大陆漂移、地面抬升或沉降、地震等。它奠定基本格局，总趋势是让地表高低不平。",
        "活动a的完整推理是：螺蚌原生活在水中 → 含壳沉积物固结成岩 → 岩层被抬升到高山。不能只写“海陆变迁”。",
        "活动b至少包含两个阶段：神庙建在陆地 → 地面沉降使石柱3.6—6.3米处浸入海水并被海生动物蛀蚀 → 地面再次抬升使痕迹露出。",
        "活动c用9米、45米、135米的连续时间数据证明某些地貌可在数小时至数日内迅速形成；与a、b的长期变化形成鲜明对比。"
      ],
      "extensions": [
        "判断地质过程先后常用四类关系：下老上新、切穿者较新、被侵蚀者较老、接触变质带晚于被变质岩。",
        "“海洋生物化石出现在高山”能支持地壳抬升或海陆变迁，不能单独证明当时山体高度、抬升速率和确切年代。",
        "一次材料可能记录多次升降，看到今天位于陆地的海蚀痕迹时，不要只写单向抬升。",
        "内力总体使地表高低不平是宏观趋势；局部也可能发生沉降，不能把内力简单等同于抬升。"
      ],
      "transfer": "用“可见证据 → 证据形成时的环境 → 后来发生的运动 → 现在的位置”四步写地质过程。",
      "summary": {
        "core": "地壳运动通过岩层变形、变位直接改变地表，是塑造地表形态的主要内力方式。",
        "chain": "水平挤压或拉伸 → 岩层变形/断裂/错动 → 地面抬升或沉降 → 留下可识别痕迹",
        "terms": [
          "构造运动",
          "变形",
          "变位",
          "挤压",
          "拉伸"
        ],
        "pitfall": "地表现在的位置不等于证据形成时的位置；恢复过程时必须写出中间的升降阶段。"
      }
    },
    {
      "page": 20,
      "pdf_page": 25,
      "title": "外力作用：识别风化、侵蚀、搬运与堆积",
      "focus": "本页建立外力作用的基本流程，并用物理风化图解释岩石为什么会在原地破碎。",
      "image": "page-20.jpg",
      "read_targets": [
        "外力作用的主要能量来源是什么？",
        "风化与侵蚀最关键的区别是什么？",
        "图2.4中岩石从完整到破碎经历了怎样的连续变化？"
      ],
      "image_reading": [
        {
          "figure": "图2.4 物理风化示意①—④",
          "observe": "岩块由完整逐渐出现裂隙，裂隙扩大，最后崩解成大小不同的碎块；碎块仍堆在原岩附近。",
          "interpret": "岩石是热的不良导体，昼夜或季节温度变化使表层与内部受热不均、膨胀收缩不同，反复作用后产生裂隙并崩解。这是原地发生的物理风化。",
          "exam_link": "根据日较差大、裸岩多、裂隙发育等条件判断物理风化强；不能因为出现碎屑就直接答侵蚀。"
        },
        {
          "figure": "正文中的冻融与根劈线索",
          "observe": "课本补充岩石裂隙中的水冻融、植物根系生长也会破坏岩石。",
          "interpret": "水结冰体积膨胀可撑大裂隙；根系生长产生机械压力。两者都主要改变岩石结构，不一定改变矿物成分。",
          "exam_link": "高寒地区冻融风化、植被根劈和干旱区温差风化常以形成条件对比设问。"
        }
      ],
      "analysis": [
        "外力作用的能量来自地球外部，主要是太阳辐射能。太阳辐射驱动大气运动和水循环，为风、流水、冰川等外力提供动力。",
        "风化发生在地表或近地表，岩石在温度、水、大气和生物影响下原地破碎、化学分解或生物分解。物理风化改变大小和形态，化学风化还改变矿物成分。",
        "侵蚀同样是破坏过程，但强调流水、波浪、风、冰川等动力刮蚀地表并带走物质。判断两者时抓住物质是否明显离开原处。",
        "搬运是风化或侵蚀产物的位置转移；流水、波浪、风和冰川既可以侵蚀，也可以搬运。",
        "当流速降低、风力减小或冰川融化时，搬运能力下降，物质沉积，逐步形成堆积地貌。",
        "四个过程常连续发生：岩石先风化形成松散物 → 外力侵蚀并带走 → 搬运到其他地点 → 动力减弱后堆积。设问可能只截取其中一环。"
      ],
      "extensions": [
        "盐结晶撑裂岩石、有水参与的冻融仍属于物理风化；“有水”不等于“流水侵蚀”。",
        "化学风化通常在温暖湿润环境较强，物理风化在温差大、冻融频繁等环境突出；具体题目仍要根据材料判断。",
        "流水搬运能力与流速密切相关。动力减弱时，一般较粗、较重颗粒先沉积，较细颗粒可继续搬运。",
        "侵蚀地貌和堆积地貌要分别写动力条件：前者常对应能量较强，后者对应搬运能力下降。"
      ],
      "transfer": "给材料中的动词分类：原地破碎是风化，刮蚀带走是侵蚀，位置转移是搬运，动力减弱停下来是堆积。",
      "summary": {
        "core": "外力以太阳辐射能为主要能量来源，通过风化、侵蚀、搬运和堆积不断改造地表。",
        "chain": "岩石原地风化 → 外力侵蚀并带走 → 流水/风/冰川搬运 → 动力减弱后堆积",
        "terms": [
          "太阳辐射能",
          "风化",
          "侵蚀",
          "搬运",
          "堆积"
        ],
        "pitfall": "风化与侵蚀都能破坏岩石，但风化强调原地变化，侵蚀通常伴随物质被带走。"
      }
    },
    {
      "page": 21,
      "pdf_page": 26,
      "title": "外力的区域差异：水热条件决定主导方式",
      "focus": "本页把外力过程放进不同区域环境，并用冰川案例与庐山平台说明内力、外力共同塑造地貌。",
      "image": "page-21.jpg",
      "read_targets": [
        "湿润区、干旱区和高山高纬区的主导外力分别是什么？",
        "图2.5哪些形态能支持冰川侵蚀？",
        "怎样用“粗毛坯—再塑造”解释庐山山体和平台？"
      ],
      "image_reading": [
        {
          "figure": "图2.5 新西兰库克山冰川侵蚀地貌",
          "observe": "山峰尖锐，山脊狭窄如刀刃，谷地宽而深，谷壁陡峭；谷中可见冰川。",
          "interpret": "移动冰川能拔蚀岩块、磨蚀谷壁并搬运物质，形成角峰、刃脊和U形谷等陡峭险峻地貌。冰川消融后，携带物质还会堆积。",
          "exam_link": "根据U形谷与V形谷、分选差的冰碛物、刃脊角峰等证据区分冰川作用和流水作用。"
        },
        {
          "figure": "庐山山顶平台的文字图景",
          "observe": "平台今天位于海拔约1100米的山体顶部，但课本说明平台是地质历史时期外力作用的结果。",
          "interpret": "平台形成时未必就在今天的高度；外力先使某一地表趋平，后来地壳隆升把古老平台抬到山顶。",
          "exam_link": "高原面、夷平面或山顶平台常要求按“外力塑平在先—地壳抬升在后—流水切割继续”分阶段作答。"
        }
      ],
      "analysis": [
        "外力类型与强度受水热组合控制。降水充沛的热带、温带地区流水充足，流水侵蚀、搬运和堆积更活跃；干旱区水少、风力突出，风沙地貌广布。",
        "高山和高纬地区气温低、积雪可长期转化为冰川。冰川在重力作用下缓慢移动，却具有很强的侵蚀和搬运能力。",
        "冰川能拔起大块岩石、加速裂解并携带物质运动；消融时搬运能力消失，物质堆积。冰川作用同样包含侵蚀、搬运、堆积链条。",
        "外力作用总体使地表起伏趋于平缓，因为高处被侵蚀、物质向低处搬运和堆积；但局部侵蚀可以形成陡壁、深谷等更险峻形态。",
        "庐山山顶平台表明地貌会继承旧形态。平台由早期外力作用形成，后来随山体隆升到达现在高度。",
        "内力与外力不是二选一。内力形成基本格局和高低起伏，外力在已有地形上继续雕刻、搬运和填积。"
      ],
      "extensions": [
        "判断主导外力必须先定位区域环境，不能“见沙答风、见谷答水”；沙也可能由流水搬运，谷地也可能由冰川侵蚀。",
        "流水侵蚀常形成V形谷，山地冰川侵蚀常形成U形谷；对比依据是谷底宽度、谷壁形态和作用介质。",
        "冰川沉积物通常大小混杂、分选较差，因为冰川消融时携带物集中卸载；流水沉积往往分选较明显。",
        "“总体趋平缓”是长期、宏观趋势，不能否定局部陡峭的侵蚀地貌。"
      ],
      "transfer": "区域地貌成因至少检查四项：气候水热、海拔或纬度、内力背景、外力作用的阶段。",
      "summary": {
        "core": "不同水热环境形成不同主导外力，地表最终是内力奠基与外力再塑造共同作用的结果。",
        "chain": "区域水热差异 → 流水/风/冰川强弱不同 → 侵蚀搬运堆积方式不同 → 地貌特征不同",
        "terms": [
          "水热组合",
          "流水作用",
          "风力作用",
          "冰川作用",
          "共同作用"
        ],
        "pitfall": "外力总体使地表趋平缓，不等于每一种外力地貌都平坦。"
      }
    },
    {
      "page": 22,
      "pdf_page": 27,
      "title": "海蚀柱与岩浆岩：从地貌演变转向岩石基础",
      "focus": "上半页用海蚀柱训练连续演变推理，下半页说明岩石是地貌和土壤的物质基础，并区分侵入岩与喷出岩。",
      "image": "page-22.jpg",
      "read_targets": [
        "海蚀柱形成、倒塌和未来演变可分成哪些阶段？",
        "岩石为什么既影响地貌又进入物质循环？",
        "花岗岩与玄武岩在形成位置和冷却条件上有什么不同？"
      ],
      "image_reading": [
        {
          "figure": "图2.6 墨尔本海岸海蚀柱",
          "observe": "孤立岩柱排列在海岸外，柱体高而陡，底部长期受海浪冲击；原有12根中已有5根倒塌。",
          "interpret": "海浪沿海岸岩体裂隙侵蚀，先形成海蚀洞，扩大贯通成海蚀拱桥，顶部崩塌后留下海蚀柱；持续侵蚀与风化会使柱体变细、失稳并倒塌。",
          "exam_link": "依据岩体裂隙、波浪方向和岩柱位置恢复海岸后退过程，预测时写清持续作用与阶段结果。"
        },
        {
          "figure": "图2.7 玄武岩与花岗岩",
          "observe": "玄武岩颜色较深、颗粒细密；花岗岩可见浅色和深色矿物颗粒，晶体较粗。",
          "interpret": "玄武岩多由岩浆喷出地表后较快冷却形成；花岗岩由岩浆侵入地下缓慢冷却形成。形成深度和冷却速度影响结晶大小。",
          "exam_link": "由气孔、柱状节理、细粒或粗粒结构判断喷出岩与侵入岩；再结合地壳抬升和剥蚀解释侵入岩为何出露。"
        }
      ],
      "analysis": [
        "海蚀柱活动要求描述过程，不能只说“海水侵蚀形成”。完整链条应包含沿裂隙侵蚀、海蚀洞、海蚀拱桥、拱顶坍塌、孤立岩柱。",
        "海蚀柱倒塌来自波浪持续掏蚀底部、风化扩大裂隙以及重力失稳。未来岩柱数量和体积会减少，海岸崖继续后退，也可能形成新的海蚀柱。",
        "岩石是构成地貌、形成土壤的物质基础。不同岩性在硬度、节理和抗侵蚀能力上不同，会影响地貌形态与演变速度。",
        "岩石按成因分为岩浆岩、沉积岩和变质岩。三类岩石可以互相转化，所以地貌塑造也伴随岩石圈物质循环。",
        "岩浆沿薄弱地带侵入岩石圈上部或喷出地表，随温度、压力改变而冷却凝固形成岩浆岩。",
        "侵入岩在地下冷却形成，代表岩石是花岗岩；喷出岩在地表冷却形成，也叫火山岩，玄武岩最常见。"
      ],
      "extensions": [
        "岩石名称与地貌名称属于不同层次：花岗岩是岩石，花岗岩峰林是这种岩石在构造和外力共同作用下形成的地貌。",
        "侵入岩形成在地下，要在地表出现，通常还需地壳抬升和上覆岩层长期被剥蚀。",